document_url,page_number,page_number_one_indexed,page_position,original_publication_date,title,credits,text_body,summary,authors,associated_places,subjects_discussed,associated_people_orgs,document_contributors,source,original_upload_date,original_archive_title,language,rights,record_id,original_classification,donors,scraped_at
https://digitalarchive.wilsoncenter.org/document/chancellors-helmut-kohls-conversation-kazakhstans-president-nazarbayev-saturday-10-may,0,1,9,"May 12, 1997","The Chancellor's [Helmut Kohl's] Conversation with Kazakhstan's President Nazarbayev on Saturday, 10 May 1997, 2.30 p.m. - 3.45 p.m. in Almaty",,"MD J. Bitterlich                                                                                                                                  Bonn, 12 May 1997
 M e m o r a n d u m
 Subject: Chancellor's Conversation with Kazakhstan's President Nazarbayev on Saturday, 10 May  1997, 2.30 p.m. - 3.45 p.m. in Almaty[1]
 Participants on the Kazakh side: President Nazarbayev, Foreign Minister Tokayev as notetaker, N.N., adviser
Participants on our side: The Chancellor, signee, interpreter (of the embassy)
Essential issues and results
1. Bilateral issues
BK thanks Pres. N for the invitation, he is thinking of visiting KAS on his way back from Beijing in the spring of 1998.
BK emphasizes that he is looking forward to the visit of President N in November in Germany. The aim of his short meeting today is to arrange good preparation for the visit in order to achieve the goal of a new quality in relations in all areas.
Preparation should take place both on the traditional track (AA, BMW, BMF, BMZ) and by personal employees (BK names signatories as contact persons for this).
Pres. N is ready to send small groups to Bonn in order to vote on the ""agenda"" in detail.
At the request of the Federal Chancellor, President N will send a strictly personal letter directly to the Federal Chancellor in the next 14 days, in which he explains his wishes and offers in detail.
President N confirmed the objective and will that KAS wanted to develop close cooperation with the EU, but above all in relation to D (Germany, if possible, in 1st place "").
He mentioned the following points where there are concrete options:
• Construction of an energy complex by Siemens
• Cooperation in the oil and gas sector
• Infrastructure issues, especially telecommunications
• Mechanical engineering
Further
• Establishment of a house of the German economy in Almaty based on the model in Shanghai processing industry (especially agricultural products)
• Promotion of the settlement of small and medium-sized enterprises (SMEs)
• Settlement of industry especially (“50%”) in the regions where people of German origin live in order to induce them to stay in KAS.
• Cooperation also in other areas in the completion and further development of the relationships in all areas across the board (e.g. security policy)
• BK adds: cooperation in the fields of science, research
• (Note: Foreign Minister Tokayev spoke to me about a ""new contract"" to bring the entire range of cooperation under one roof; I was very reluctant to get involved)
Comments from President N. on individual areas and on economic development
Exploitation of riches in mineral resources of various kinds, especially oil and natural gas. KAS would like to increase production (now 26 million tons - target 2000: 50 million tons, 2010 100 million tons with own consumption of 20 million tons) and export to (Western) Europe;
Different ways imaginable
- either via RUS (RUS, however, sees competition in KAS and has so far refused transit); Please contact BK to influence RUS in this respect)
- or about Iran (problem: political situation)
- or via Afghanistan / Pakistan (problem: war in Afghanistan without end)
- or to / via China (on this first positive discussions)
To this end, they want to work with German companies. The pipeline to the Black Sea will pay for itself in 2-3 years after completion.
Also important for investors: political stability in the country, privileges for investors, convertible currency and profits, inflation in 1997 only 17% (in 1993 still 2500%). Currency stable against the dollar. Significance of KAS as a transit country (example: railway connection - Japan. Money for expansion of border station to China; fiber optic connection along the route).
2. Regional and international issues
a) Relationship with Russia
N described ratio as actually normal (except for problems with regard to oil / natural gas - see above). He is in close personal contact with Yeltsin and Chernomyrdin. The last meeting in Moscow a fortnight ago.
Yeltsin had promised to fully support the ""two new boys"". From his, N's point of view, this was absolutely necessary, as many obstacles would be put in their way. His overall impression: Chubais and Nemtsov would advance the reforms (e.g. start, to break up the monopolies like Gazprom); if things go on like this, real positive changes can be expected in 2 years; it is a misfortune that Moscow and the regions were pulling on different strands.
b) Development in China
N think there won't be any big changes anytime soon - one has to be prepared for Jiang as president for the next 10 years. When asked about the successor to MP Li Peng, N. said, ""hard to say"", he estimated that it would be the current deputy MP for economics Zhu Rong. In any case, the leadership would be well advised to pick an economic expert.
c) Development in Iran
In response to questions from BK, N explains that he has very good relationships with the leadership and that he will meet Rafsandjani again in 3 days. Fundamentalism was not a problem - Kazakhs were not religious, but a real problem in Uzbekistan. He had worked a lot to bring Iran and the US together, so far without success, even if both sides kept saying that they wanted to. Rafsandjani wanted to open up the country. However, he said the Islamic revolution was only 15 years old. As long as the mullahs were still in power, it was basically impossible to turn the country into a secular country. However, the generation of 30-40 year olds hated the regime, which could not last in the long term. The U.S. blockade policy, however, is not the right approach towards Iran.
The Chancellor agrees with the latter statement. He, too, had repeatedly taken the view that it was not wise to drive a country into isolation (see the discussion on China). N. could say this to Rafsandjani. U.S. policy towards Iran has an irrational background. He had tried very hard to keep a middle line and was attacked a lot for it. He also sought talks with Iran on behalf of the murdered Israeli MP Rabin because of the locked Israeli pilot Ron Arad.
N. throws in that he was also called in because of this - the pilot probably did not exist.
The Chancellor asks how much power did Rafsandjani actually have? He was now leaving office. What did the leadership really want? Lately we had had the Mykonos affair. An independent court had made clear statements about Iran's involvement - the federal government had no influence whatsoever on the judges and the verdict - the courts were completely independent. Iran did not want to understand this and has reacted inappropriately. His interest was to help reduce tensions. He believes that Rafsandjani was basically good willed - something else probably applied to the religious leadership.
N. points out that Rafsandjani would be leaving in May. He did not submit to the religious leadership. He would take on an important function in the Islamic Council - and thus had a de facto influence on all areas of the country. The current President of Parliament, Nuri, had the best chance of being promoted by the religious leadership. No matter who could get hold of it, the country had to open up. But Iran was primarily interested in working with Germany. If the Chancellor wanted, he could use his influence and urge high-ranking people from Iran come to Germany.
The Chancellor agrees with the analysis that there was no other way than opening up in the long run. His interest was not escalation. Now one had to wait for the choice. Then it would be Iran's turn. At the moment, it did not make sense to talk to Iran. First of all, Iran had to make genuinely positive gestures in order to significantly improve the mood.
N. said that a complete turnaround in the political leadership in Iran would not be possible anytime soon. However, the tendency was important, especially since the younger generation was moving away from the stigma of the mullah regime.
In truth, the were already leading a double life today. He agreed with the Chancellor’s basic assessment. In any case, the policy of the Americans was wrong. He had the impression that Iran wanted to establish close associations with Germany as the largest European country. This could trigger a helpful development.
The Chancellor repeated that he was against an embargo policy, but first the climate in Tehran had to change. It was now Iran’s turn. N. only has to consider the previous allegations from the American Congress against the Germans; now the ruling on the terror attack in Berlin has been added, which the Americans accept as evidence of their policies. If he, N., saw Rafsandjani, he could tell him that he, the Federal Chancellor, did not want an escalation, that real gestures on the part of Iran were now necessary.
In response to questions from the Chancellor, N. explained that the President of the Parliament, Nuri, was recently in Almaty on his way to Moscow. He made it very clear to him that Iran's policy must change. He replied that Iran did not want to extend fundamentalism to other countries; if he was elected, he wanted to open up the country's economy.
The Chancellor asks N to keep him informed about his further talks with Iran directly.
d) Situation in Afghanistan
In response to questions from the Chancellor, N. explains the situation in Afghanistan: Although there is no common border (500 km away; immediate border only Tajikistan; while the Chinese border is 300 km away). The situation was being followed very carefully, especially since the route via Afghanistan / Pakistan would be ideal for the export of oil and natural gas (the same applied to the Turkmen and Uzbek sources). Ultimately, he says, he didn’t care who was in power in Afghanistan: The essential thing was to finally gain clarity and calm in Afghanistan. War had been raging there for 20 years. Everyone tried to end the war, but to no avail. The troops on the border between Tajikistan and Uzbekistan had been reinforced to prevent individual groups from spilling over. Pakistan was currently supporting the Taliban. However, it was unknown who was at the top. Dostum and Moussad were other important figures. One tribe fought against the other; each region had its own bosses. Iran (like the U.S. and Saudi Arabia) supported the Taliban.
e) NATO Expansion
N. emphasizes that he appreciated the fact that the Chancellor was including Russia in the European process. Neither Yeltsin nor Chernomyrdin were actually against NATO expansion; they just didn't want to lose face.
The Chancellor explained that he was trying to help. Many in the West were not very smart about this. His position was simple: He was trying to help involve Russia and at the same time support the reform process. He could not make a forecast. But if you did not help, the risk was greater. His goal was a good, sensible relationship.
N. replied that he had advised the Russian leadership to proceed pragmatically. One had to keep in mind that there were of course opponents in Moscow,
the Communists and those who had not given up imperial thinking. They wanted power, which of course would be bad for Russia, Europe and Kazakhstan. One had be very careful that these forces did not gain the upper hand. And one had to ensure that positive support gave them a ""muzzle"". Of course, some of the Russian demands went too far. The Russians could not expect to decide on key NATO issues.
(Bitterlich)
  [1] BArch, B 136/59748, 326-334.","Kohl and Nazarbaev dissus a variety of issues including Russia, China, NATO enlargement and the domestic situation in Iran against the backdrop of the end of Rafsandjani's tenure in 1997. Kohl reiterates his willingness to engage Iran. At the same time, he stresses the need for Iran to move first in order to show goodwill.",,"[""Germany"", ""Kazakhstan"", ""Russia"", ""China"", ""Iran"", ""Afghanistan""]","[""Germany--Foreign relations--Kazakhstan"", ""Kazakhstan--Foreign relations--Russia"", ""Iran--Politics and government"", ""Afghanistan--Politics and government"", ""North Atlantic Treaty Organization""]","[""Bitterlich, Joachim"", ""Rafsanjani, Akbar Hashemi""]","[""Kohl, Helmut"", ""Nazarbayev, Nursultan Abishuly""]","BArch, B 136/59748, 326-334. Contributed, transcribed, and translated by Stephan Kieninger.",2023-10-03,"[""German Federal Archives (BArch)""]","[""German""]","The History and Public Policy Program welcomes reuse of Digital Archive materials for research and educational purposes. Some documents may be subject to copyright, which is retained by the rights holders in accordance with US and international copyright laws. When possible, rights holders have been contacted for permission to reproduce their materials.
To enquire about this document's rights status or request permission for commercial use, please contact the History and Public Policy Program at HAPP@wilsoncenter.org.",300239,,,2025-10-07T12:41:18.215836
