document_url,page_number,page_number_one_indexed,page_position,original_publication_date,title,credits,text_body,summary,authors,associated_places,subjects_discussed,associated_people_orgs,document_contributors,source,original_upload_date,original_archive_title,language,rights,record_id,original_classification,donors,scraped_at
https://digitalarchive.wilsoncenter.org/document/statement-nakajima-kenzo-chairman-board-opposing-visit-prime-minister-sato-united-states,0,1,5,November 1967,"Statement of Nakajima Kenzo, Chairman of the Board, Opposing the Visit of Prime Minister Sato to the United States and Protesting the Coming to Japan of Chiang Ching-kuo",This document was made possible with support from Chun & Jane Chiu Family Foundation,"Statement of Nakajima Kenzo, Chairman of the Board, Opposing the Visit of Prime Minister Sato to the United States and Protesting the Coming to Japan of Chiang Ching-kuo
 The Sato Government has disclosed that it is “inviting” Chiang Ching-kuo to Japan on November 27.
Chiang Ching-kuo is a leader of the Chiang Kai-shek Group that was driven out by the 700 million people of China, the “Minister of National Defense,” the ringleader who controls their military, military police, and special service units. We, who desire true friendship and cultural exchange between the people of Japan and China, cannot accept that such a person, who interferes in the internal affairs of China, should step on the soil of Japan.
Prime Minister Sato’s “visits” to South Korea, Taiwan, and South Vietnam supported the disgraceful war of aggression in Vietnam, viewed with hostility the 700 million people of China, and trampled upon the aspirations of the peace-loving Japanese people. In particular, that the authorities inflicted brutal repression against people who were demonstrating on October 8 against Prime Minister Sato’s departure from Haneda Airport, which went so far as to end in the taking of a life, speaks eloquently to the militarization and fascist character of the Sato government. Prime Minister Sato, furthermore, announced on November 12 his intention to “visit” America, ignoring the widespread anger of the Japanese people, but we absolutely cannot overlook the policy of the Sato government, which is turning its back on the Japanese people and looking away from the world’s progress, of looking with hostility at China and following American imperialism.
Voices that oppose the invasion of American imperialism and desire the liberation of the oppressed people are rising higher and higher. Chiang Ching-kuo’s “coming to Japan” – when even in America, the invading country, popular protest and struggle are blazing up, arranged with the intent to strengthen collusion with the Chiang Kai-shek faction that has drawn American imperialism into Taiwan, territory of the People’s Republic of China, and has become under its protection the running dogs of American imperialism – is a plot to destroy from the roots the friendship and exchange of the people of Japan and China that the people of Japan and China have diligently cultivated. We absolutely cannot accept it. Chiang Ching-kuo’s “coming to Japan” is a stupid action equivalent to the Sato government strangling itself.
In order to oppose Chiang Ching-kuo’s “coming to Japan” and stop it, we are determined, in appealing broadly to public opinion and collaborating with relevant persons from various spheres, to carry out a resolute struggle.
 Nakajima Kenzo, Chairman of the Board
Japan China Cultural Exchange Association","Nakajima Kenzo, a leading figure in the Japan China Cultural Exchange Association, denounces the impending visit of Chiang Ching-kuo to Japan.","[""Nakajima, Kenz\u014d"", ""Japan-China Cultural Exchange Association""]","[""Japan"", ""Taiwan"", ""China"", ""United States""]","[""Japan--Foreign relations--Taiwan"", ""China--Foreign relations--Japan"", ""China--Foreign relations--Taiwan"", ""Taiwan--International status"", ""Taiwan--Politics and government""]","[""Chiang, Ching-kuo (Jiang Jingguo)"", ""Chiang, Kai-shek (Jiang Jieshi)"", ""Sat\u014d, Eisaku""]",,"Diplomatic Archives of the Ministry of Foreign Affairs of Japan, File A’0392 (Microfilm). Contributed by Robert Hoppens and translated by Stephen Mercado.",2023-10-05,"[""Diplomatic Archives of the Ministry of Foreign Affairs of Japan""]","[""Japanese""]","The History and Public Policy Program welcomes reuse of Digital Archive materials for research and educational purposes. Some documents may be subject to copyright, which is retained by the rights holders in accordance with US and international copyright laws. When possible, rights holders have been contacted for permission to reproduce their materials.
To enquire about this document's rights status or request permission for commercial use, please contact the History and Public Policy Program at HAPP@wilsoncenter.org.",300638,,"[""Chun & Jane Chiu Family Foundation""]",2025-10-07T12:40:45.802819
https://digitalarchive.wilsoncenter.org/document/chancellors-helmut-kohls-meeting-british-pm-blair-20-october-1997-1030-am-3-pm-chequers,0,1,6,"October 31, 1997","The Chancellor's [Helmut Kohl's] Meeting with British PM Blair on 20 October 1997, 10.30 a.m. - 3 p.m. in Chequers",,"MD J. Bitterlich                                                                                                                  Bonn, 31 October 1997
 M e m o r a n d u m
 Subject: The Chancellor's Meeting with British PM Blair on 20 October 1997, 10.30 a.m. - 3 p.m. in Chequers[1]
here: essential topics and results
 At the above-mentioned meeting, which took place in a very friendly and open-minded atmosphere. the following topics were mainly dealt with:
1. domestic political development in both countries
2. Further orientation of European policy (""Great Britain in Europe"")
3. European Economic and Monetary Union
4. European aerospace industry
5. Preparation of the special session of the European Council on Employment on 20./21. November 1997
6. European Agenda 2000 (enlargement, finance, agricultural policy)
7th conference on Nazi gold in London from 2-4. December 1997
8. EU tobacco advertising
9. BSE
10. Preparation of the G8 summit in Birmingham 15.-17. May 1998
From the conversation, especially with regard to the operational conclusions, I essentially state:
Discussion of the domestic political situation in both countries (especially the economy, employment issues, attitudes to immaterial values)
European Economic and Monetary Union
PM stated that government would give an statement on its position in the near future. He and his government were in principle in favor of monetary union. He assumed that Great Britain would not be in the first group in 1999. It was also unlikely that the decision would be made before the next general election in 2001/2002. He needed time to convince the public of the monetary union and European policy. It was very difficult to win a referendum; his government could not afford defeat. There were no constitutional obstacles. Of course, it was also important that the economic environment was right for the euro. It was vital that the euro would actually work.
Britain would lead its 1998 EU Presidency in a constructive manner, ensuring that decisions would be taken according to the timetable and criteria. It was desirable that the largest possible number of member states would join in .
BK affirmed that the monetary union had to come now. No objection to Great Britain would join in in 2001/2002. He would see to it that the Europeans would not put up any barriers to this. From his point of view, it was important not to maneuver GB into a corner.
 Great Britain’s Role in Europe
BK expresses understanding for the difficulties British politics faces in relation to Europe. As a result, his policy was consistent with the policy of the Prime Minister. He wanted his thesis ""Great Britain needs Europe, but Europe also needs Great Britain"" to become a reality.
PM explains in detail the historical background of the relationship between Great Britain and Europe. He wanted to make it clear that Britain's place was in Europe. The stronger the relationship with Germany, but also with France, the easier it would it be for Great Britain to be a real player in the EU. He expresses understanding for the differences in the German-French relationship compared to the German-British or French-British relationship based on history.
BK advocates setting positive practical examples in the German-British relationship (as in Europe in general). This applies, for example, to the aerospace industry, but also to partnerships, for young people, business and science. Affirmation that the next few years would be decisive for this. Europe had to find its identity now, also because of internal American development (tendency to look inward).
PM emphasizes that his problem was the public and the press. But he thinks he could make the transition. It was important for him that the Europeans helped him to show how we in Europe would actually create alliances among equals.
When asked, BK explains the Franco-German agreement on the ""Eurorat"" (informal nature; meeting in connection with meetings of the Ecofin Council), which should not cause problems for GB.
PM asks about agreement on German-French-Russian summits.
BK explains the history and background of this agreement with Yeltsin and Chirac. Indication of Italian irritations. He, Blair, would not have any problems with BK here.
European Aerospace Industry
As an example of close cooperation, BK ties in with the need to bring the European aerospace industry together. This presupposes prudence on both the British and German sides in order to get the French on board.
PM agrees. Restructuring of European industry is important, otherwise European industry would be eaten up by America. Trilateral action Germany - France - Great Britain is the key. BK also refers to the inclusion of Italy, Spain and Sweden.
Afterwards a short exchange of views on domestic political developments as well as on linking the military and civilian areas in the USA.
Preparation of the special European Council on Employment 20-21 November 1997
PM then addresses employment summits and emphasizes, referring to the preparatory work of the employees, that GB and D are by and large probably on the same line.
At the request of BK, I explained the state of opinion-forming, in particular with reference to the paper sent at short notice by the British, but pointed out that the adoption of quantitative guidelines proposed by the Commission and supported by PM Juncker caused us considerable problems.
PM pointed out that from a British point of view, qualitative guidelines were more important. The key was the right message from this special summit. From a British perspective,
the focus should be on questions of employability, the reorientation of social policy and support for small and medium-sized enterprises. Germany was also looking for impulses in the latter area.
BK agrees and especially refers to the need for start-ups; this aspect is a weakness in Europe.
PM agrees. Part of the economic reforms. which Margaret Thatcher initiated in the UK were correct. Employment summit had to send out clear signals in the direction of employability and small and medium-sized enterprises; bureaucratic hurdles should be removed in the latter area.
Agenda 2000 (Finance. Agriculture)
BK addresses Agenda 2000. With regard to agricultural policy as well as finances, German-British problems could be foreseen with certainty. This also applied in particular to agriculture, where the British and German positions had always been diametrically opposed.
PM replies that he understands very well that this is a very sensitive topic in D. EU needs further reforms in the agricultural sector. He assured BK, however, that he would deal with this issue very sensitively, especially during the EU presidency.
Tobacco Advertising
BK refers to the efforts of the LUX Presidency to enforce a general ban on tobacco advertising at the meeting of EU health ministers on December 4th in LUX. This would also affect Formula 1, with the consequence that the races would go away from Europe. From his point of view, the aim must therefore be to achieve at least exemptions here.
PM refers to a recent visit from Ecclestone and Mosley to him. Basically, it would be the right line in itself to leave possible measures here to the individual member states in application of the subsidiarity principle. In any case, he had no intention of losing Formula 1 from the UK and will speak to the Minister of Health.
Nazi Gold Conference in London
BK emphasizes that the federal government wanted to be helpful. If one was not careful, however, the conference would take a completely different direction.
PM points out that the conference would be led by Lord Mackay, Lord Chancellor of the previous Conservative government. He is a very clever, balanced man. He would formally ask the Foreign Minister to act in a careful, sensitive manner at the conference.
The conversation will then continue over lunch.
First a short exchange of views on the question of BK about the development of the press in the UK.
BSE
PM pointed out that GB had made a number of proposals which had already passed through the Scientific Committee and which were now to be discussed and decided in the Veterinary Committee. He very much understood the concerns of the German public with regard to BSE; GB had introduced the safest rules and controls today. He emphasizes that he would be grateful to BK if D - even if there were differences in the matter - did not ensure that there was a mood against GB and for a strong opposing position.
BK agrees to review the issue. He points to problems in the Federal Council as well as to German mood and the difficult situation of the farmers.
EU Enlargement
PM briefly explains the direction of the British position in relation to enlargement and Agenda 2000, focusing on the following:
GB supported the Commission's approach of starting negotiations with the five CEE countries and Cyprus; all other countries would have to stay in the process.
GB was in principle in favor of a European conference. One was aware of the problem of Turkey. But something had to be done for Turkey.
With regard to Agenda 2000, the UK believed that pervasive reforms of the common agricultural policy were necessary. It was important to decide the relevant benchmarks for future finances as early as December. Of course, GB wanted to stick to its premium reduction. But they understood the German problem and thought about how to help here.
With regard to Cyprus, BK stressed that he had serious concerns, even if one disregarded the basic unresolved issues. In this respect, he points to findings that Cyprus is increasingly becoming a central hub for the Russian mafia.
BK goes on to say that in matters of enlargement, it was crucial for us to manage it politically and psychologically to start negotiations now with a first group, but at the same time to encourage the other countries of Central Eastern Europe.
In response to questions from BK, PM explained his ideas with regard to the European conference proposed by the Commission and the
with regards to its key points and structures. In this way, a kind of forum could be created in order to underline to these countries that they were on their way to joining the European Union as candidate countries.
BK critically questions the structure of such a conference, also with regard to meetings on a political level, and confirms that he reserved the right to comment and that we still have to discuss it in detail.
With regard to the Turkey problem, he explains that D is in no way opposed to Turkey, on the contrary - Yilmaz is a good man. The decisive problem for D was freedom of movement. Without a solution to this problem, D could not agree to join at a later date.
PM agrees with BK's assessment and emphasizes that one had to try to find ways out. The question was whether an exception can be made.
BK repeats that one has to work out a solution that definitely eliminates the problem for D. Moreover, he had emphasized to Demirel and Yilmaz - and they had agreed with him - that accession would not be due for decades. Of course, one had to be careful not to damage the forces that oppose fundamentalism.
PM affirms that BK was right. GB stood in its sympathy on the German side.
Preparation G 8 - Birmingham
The BK and PM agree on the organization and structure of the summit on the basis of the PM's letter and the proposals of Sherpa Undersecretary Stark.
(Bitterlich)
  [1] BArch, B 136/59748, 403-410.","Kohl and Blair examine Britain's role in Europe. They discuss European Economic and Monetary Union, European aerospace industry, the agenda 2000 for Europe, EC enlargement and the convocation of the G-8 summit in Birmingham in 1998.",,"[""Germany"", ""Great Britain""]","[""Germany--Foreign relations--Great Britain"", ""Europe--Economic integration""]","[""Bitterlich, Joachim""]","[""Kohl, Helmut"", ""Blair, Anthony Charles Lynton (\""Tony\"")""]","BArch, B 136/59748, 403-410. Contributed, transcribed, and translated by Stephan Kieninger.",2023-10-03,"[""German Federal Archives (BArch)""]","[""German""]","The History and Public Policy Program welcomes reuse of Digital Archive materials for research and educational purposes. Some documents may be subject to copyright, which is retained by the rights holders in accordance with US and international copyright laws. When possible, rights holders have been contacted for permission to reproduce their materials.
To enquire about this document's rights status or request permission for commercial use, please contact the History and Public Policy Program at HAPP@wilsoncenter.org.",300242,,,2025-10-07T12:40:53.682447
